planning_area,subzone,poi_dimension,review_count,avg_review_rating,noise_positive_mentions,noise_negative_mentions,crowding_positive_mentions,crowding_negative_mentions,cleanliness_positive_mentions,cleanliness_negative_mentions,safety_positive_mentions,safety_negative_mentions,convenience_positive_mentions,convenience_negative_mentions,price_positive_mentions,price_negative_mentions,representative_reviews,noise_net_mentions,crowding_net_mentions,cleanliness_net_mentions,safety_net_mentions,convenience_net_mentions,price_net_mentions
Clementi,West Coast,education,20,4.75,1,0,1,0,1,0,0,0,0,0,0,1,"We’ve been with this school for more than two years and have had a very positive experience. What first attracted us was the lovely outdoor playground and weekly activities like mu... || From the very first visit me and my husband made 5 years ago, we knew this was the right preschool for our son — the outdoor space is so big and full of nature exposure, exactly wh... || The teachers and the overall staff are so welcoming and warm. They are patient and very caring and really made settling in very easy. They also patently tell you all details daily ...",1,1,1,0,0,-1
Clementi,West Coast,transport,6,4.667,0,0,0,0,0,0,0,0,2,0,0,0,Nice to have a train station near a industrial area but it‘s a bit sad they have to close a school because of it. || A future MRT station for Jurong Region Line and Cross Island Line. || Very good. Not open yet,0,0,0,0,2,0
Clementi,West Coast,food,15,4.333,0,0,1,3,0,1,0,0,0,0,3,0,"*Dapur 3A Power Kacang Pool @Ayer Rajah Food Centre* It's been a while that I feel compelled to give a review but after returning for a second helping I knew I wanted to. I'm truly... || A good and spacious Food Centre that offers delicious food at a reasonable price. For vegans and vegetarians, there’s a stall serving delicious local Chinese vegan food (V4 Vegetar... || @Ayer Rajah Food Centre If you’re craving authentic Indian-style Mee Siam, the Mee Siam Mama with rusuk at Ayer Rajah Food Centre is seriously one of the hidden gems in the west. T...",0,-2,-1,0,0,3
Clementi,West Coast,shopping,15,3.0,0,0,1,2,2,0,0,1,5,0,2,2,"I visited Cold Storage on Thursday to purchase a large potted plant, and I was truly impressed by the excellent customer service. The plant didn't have a price tag, so the manager ... || Nice, big and spacious. Great place to shop for groceries. For vegans and vegetarians, there are also plenty of plant-based stuff. || Huge variety of well displayed items. But due to the manpower shortages, some expired products and rotten fruits are not well spotted. Like their weekly discount shelves and also t...",0,-1,2,-1,5,0
Clementi,West Coast,recreation,5,3.6,0,0,1,0,3,0,0,1,0,0,0,0,"My daily morning charge up spot. I go here regularly for yoga, fresh air and morning sun. Cozy grass and shady tall trees for the perfect picnics and naps. Plenty of space. Beautif... || On November 27, 2005, West Coast Place Playground was opened to the public by the then Member of Parliament for Ayer Rajah SMC, Dr. Tan Cheng Bock as part of the upgrading project ... || At 8.27pm 4.5.22, this playground park is in total darkness. Why are the lights not switched on? Aren't they sensor controlled? Danger lurks for one who walks through it. Parallel ...",0,1,3,-1,0,0
Clementi,West Coast,nature,6,3.333,1,0,1,0,0,0,0,0,1,0,0,0,"A bare open grass field beside West Coast Way and West Coast Road, offering quiet and spacious surroundings but rarely used. It lacks dedicated facilities or shade, giving it no cl... || Not really a garden but big grass field along West Coast Road. Sign to warn against trespassing already set up… it is surrounded by the landed property and in between west coast ce... || This structure offers one a shade from the current hot sun or shelter from the sudden rain, however limited it is. It was also intended to beautify the estate, and provide a shaded...",1,1,0,0,1,0
