planning_area,subzone,poi_dimension,review_count,avg_review_rating,noise_positive_mentions,noise_negative_mentions,crowding_positive_mentions,crowding_negative_mentions,cleanliness_positive_mentions,cleanliness_negative_mentions,safety_positive_mentions,safety_negative_mentions,convenience_positive_mentions,convenience_negative_mentions,price_positive_mentions,price_negative_mentions,representative_reviews,noise_net_mentions,crowding_net_mentions,cleanliness_net_mentions,safety_net_mentions,convenience_net_mentions,price_net_mentions
Jurong West,Wenya,recreation,15,4.267,2,2,1,1,3,0,0,1,7,0,0,0,"Stepping into the Omni-Theatre at Science Centre Singapore felt like entering a completely different world. This isn’t your usual cinema — the massive dome screen and immersive sur... || Brought my kids here today. It was pleasant even though 20mins into the show, one fell asleep and the other one was looking forward to the “good part” as we were expecting a show a... || As part of SG60, there was a promotion to visit the science centre and the Omni theatre free. It was a bit confusing though as although the ticket listed this two places as free, y...",0,0,3,-1,7,0
Jurong West,Wenya,nature,10,4.6,2,0,0,0,3,0,2,0,6,0,0,0,"It is a lovely and relaxing spot, located close to Palawan Beach and easily accessible from Beach Station. There are convenient amenities nearby, including a 7-Eleven, making it ea... || We went just to see it by our own eyes. It was not something you will be amazed if. It was okay. The sand was imported from Australia. The activities looks okay. I think most local... || Very clean, handy free transport link options between beaches. Lots of activities and eateries. Easy access for those with poor mobility, pushchairs, etc Family friendly",2,0,3,2,6,0
Jurong West,Yunnan,education,28,4.107,1,1,1,1,4,0,1,0,2,0,0,0,"Transferring my child to this school was the best decision ever! She’s been at MapleBear Jurong West from Nursery all the way to K2 and we have absolutely no regrets.The school is ... || One thing we really like is that the school has its own kitchen and prepares fresh meals daily. It gives us peace of mind knowing what our child is eating. The teachers are caring ... || This school is more about babysitting than education. Although My kid stayed there short term, I found there’s no structured teaching or knowledge reinforcing system like other sch...",0,0,4,1,2,0
Jurong West,Yunnan,transport,10,3.4,0,0,0,1,1,0,0,0,2,0,0,0,"I frequent this bus stop as 179 is the only bus from Pioneer that enters NTU. The sign informs commuters of the bus services available at the bus stop 1. Code choice English is the... || ***257 doesn't exist*** Thank fully was able to reroute with Gmaps! +1 star for that, but still oh em gee || Bus 255 no longer stops here. Please update the information.",0,-1,1,0,2,0
Jurong West,Yunnan,food,14,3.571,3,0,0,0,0,0,0,0,0,0,4,2,"It was my first time trying out this brand of mala. Such a disappointment, I bought dry mala for take away but when I got home & try, the taste was soooo bland and tasteless. 👎 Was... || My fave halal mala spot finally reached JURONGGGGGG!!! I will always make my way to the first outlet at Jalan Kayu and it’s always been consistent. Staffs are always friendly and i... || Ordered from grab.. So happy to have another halal mala option in Jurong.Bought the dry mala.So much variety of ingredients to choose from. Previously i took the Hot spicy level wh...",3,0,0,0,0,2
Jurong West,Yunnan,shopping,15,4.4,1,0,0,0,2,0,0,0,1,0,0,0,"Multiple varieties of Indian Groceries and Fresh Vegetables, Good Housekeeping. Easy assesibility. Location at Blk 153, Jalan Teck Whye. || Good shop to find lots of Indian products at reasonable rates. Friendly staff and well maintained shop || Good Indian Vegetable Shop in Jurong West!!! AMMAN Vegetable Shop at Jurong West Street 91 Market is a very good place for fresh vegetables, especially for Indian groceries. The pr...",1,0,2,0,1,0
Jurong West,Yunnan,recreation,0,0.0,0,0,0,0,0,0,0,0,0,0,0,0,,0,0,0,0,0,0
Jurong West,Yunnan,nature,0,0.0,0,0,0,0,0,0,0,0,0,0,0,0,,0,0,0,0,0,0
