planning_area,subzone,poi_dimension,review_count,avg_review_rating,noise_positive_mentions,noise_negative_mentions,crowding_positive_mentions,crowding_negative_mentions,cleanliness_positive_mentions,cleanliness_negative_mentions,safety_positive_mentions,safety_negative_mentions,convenience_positive_mentions,convenience_negative_mentions,price_positive_mentions,price_negative_mentions,representative_reviews,noise_net_mentions,crowding_net_mentions,cleanliness_net_mentions,safety_net_mentions,convenience_net_mentions,price_net_mentions
Central Water Catchment,Central Water Catchment,education,10,4.9,3,0,2,0,4,0,0,0,1,0,0,0,"Visited the National Library Building mainly for The Albatross File: Singapore’s Independence Declassified exhibition, and it turned out to be a meaningful experience. The exhibiti... || The National Library is conveniently located with good traffic access from around the island. It’s a comfy cool place to be if your want to study, research and just reading. You ma... || The Albatross File exhibition at NLB is a fascinating showcase of Singapore’s separation history, featuring declassified documents, oral histories, and immersive multimedia display...",3,2,4,0,1,0
Central Water Catchment,Central Water Catchment,transport,10,4.5,3,1,1,1,1,0,0,0,4,0,0,0,"Watching Commonwealth MRT Station rise from the ground years ago is a memory etched in grit, defined by enduring endless clouds of construction dust and grinding gridlock along Com... || nearly have to walk down 2 flights of stairs ! Lucky to meet the nice cleaner who stopped me and directed me to the other hidden invalid toilet at the other side of a store entranc... || New stall Veggie stall at morning: mee hoon, brown rice + others veggie 🥕 for your selection.",2,0,1,0,4,0
Central Water Catchment,Central Water Catchment,food,10,4.4,0,0,0,3,2,0,0,0,0,0,1,0,"This place has been around since we were young. And it is known to host many shops that sells the products for military, police and such. Lets dive in! Food: There have been change... || Besides the ever-popular claypot rice & Hokkien prawn mee (which had a long queue despite the odd hours), try out Dragon Curry’s Nan ru pork cutlet curry rice! Sweet curry with a l... || There are actually three levels at Golden Mile Food Centre. Most will visit the 1st and 2nd level where many good and popular food stalls are located but little people visit the 3r...",0,-3,2,0,0,1
Central Water Catchment,Central Water Catchment,shopping,10,4.2,0,0,1,0,0,0,0,0,1,0,0,0,"we were so happy to find Sheng Shiong aupermarket where we xan come to grab ingredients for our dinner on the way home after spending an afternoon shopping in IKEA. this super is v... || I am a regular customer at your Commonwealth outlet and frequently purchase the Penguin Durian Ice Cream. I would like to share some feedback regarding the freezer display. Every t... || Spacious, well-organised and good pricing. This outlet is quite extensive and varied. There is a good selection of groceries and several interesting finds. It is linked to multi-st...",0,1,0,0,1,0
Central Water Catchment,Central Water Catchment,recreation,10,4.3,2,0,1,0,4,0,0,1,4,0,0,0,"Hidden away in the Rifle Range greenery, Temasek Club honestly feels like one of those underrated chill spots in Singapore. The whole place has a peaceful resort vibe with lots of ... || On 6 March 2026, I had the privilege of visiting Temasek Club during a Taiwan–Singapore exchange meeting. The venue is beautiful and well maintained, creating a welcoming and refin... || Nice and clear place and the foods are damn good 👍",2,1,4,-1,4,0
Central Water Catchment,Central Water Catchment,nature,10,4.9,16,1,1,2,3,0,0,0,0,0,0,0,"Lower Seletar Reservoir Park is such a peaceful and scenic spot in Singapore! 🌅 The waterfront views are beautiful, especially during sunrise and sunset, and the park is very well ... || 10/10, would absolutely paddle back for this again. 🌅🚣‍♂️ The sunrise kayak + breakfast tour was such a peaceful, feel-good start to the day. Ali and Shiva were fantastic, friendly... || The park is beautifully maintained, with a delightful variety of flowers that add color and charm to every corner. Each pathway feels inviting, filled with vibrant blooms and natur...",15,-1,3,0,0,0
